{"$schema":"https://json-schema.org/draft/2020-12/schema","$id":"https://synapse.kkloudtarus.net/docs/schemas/events/risk_acceptance.expiring.v1.schema.json","title":"risk_acceptance.expiring event (v1)","type":"object","properties":{"id":{"type":"string","minLength":1},"type":{"type":"string","const":"risk_acceptance.expiring"},"source_kind":{"type":"string","minLength":1},"source_id":{"type":"string","minLength":1},"schema_version":{"type":"integer","const":1},"occurred_at":{"type":"string","format":"date-time"},"engagement_id":{"type":"string"},"severity":{"type":"string"},"data":{"type":"object","properties":{"title":{"type":"string"},"summary":{"type":"string"},"finding_id":{"type":"string","minLength":1},"engagement_id":{"type":"string","minLength":1},"assessment_id":{"type":"string","minLength":1},"acceptance_id":{"type":"string","minLength":1},"acceptance_version":{"type":"integer","minimum":1},"expires_at":{"type":"string","format":"date-time"},"reminder":{"type":"string","minLength":1},"lead_time_seconds":{"type":"integer","minimum":1},"tier":{"type":"string","minLength":1},"team_id":{"type":"string"},"assignee_user_id":{"type":"string"},"actor_user_id":{"type":"string"},"deadline":{"type":"string","format":"date-time"},"accepted_at":{"type":"string","format":"date-time"}},"required":["title","summary","finding_id","engagement_id","assessment_id","acceptance_id","acceptance_version","expires_at","reminder","lead_time_seconds","tier"],"additionalProperties":true}},"required":["id","type","source_kind","source_id","schema_version","occurred_at","data"],"additionalProperties":true}
