{"id":"event-risk-expiring","type":"risk_acceptance.expiring","source_kind":"risk_acceptance_reminder","source_id":"acceptance-42:86400","schema_version":1,"occurred_at":"2026-10-10T08:00:00.123456789Z","engagement_id":"eng-42","data":{"title":"Risk acceptance expiring","summary":"A risk acceptance will expire soon.","finding_id":"finding-42","engagement_id":"eng-42","assessment_id":"assessment-42","acceptance_id":"acceptance-42","acceptance_version":1,"expires_at":"2026-11-10T08:00:00.000000000Z","reminder":"expiry_warning","lead_time_seconds":86400,"tier":"high","team_id":"team-42","assignee_user_id":"user-42","actor_user_id":"system"}}
